{
  "id": "act_1914_08_10_liege_bombing_0001",
  "action": "Bombing Liège",
  "place": {
    "name": "Liège",
    "country": "Belgium",
    "lat": 50.6326,
    "lon": 5.5797
  },
  "time": {
    "value": "1914, Aug 10",
    "precision": "day"
  },
  "references": {
    "primary": {
      "type": "wikipedia",
      "url": "https://en.wikipedia.org/wiki/Battle_of_Li%C3%A8ge?oldid=123456789",
      "content_hash": {
        "algo": "sha256",
        "value": "e3b0c44298fc1c149afbf4c8996fb92427ae41e4649b934ca495991b7852b855"
      }
    }
  }
}
